"name","address","city","state","zip_code","latitude","longitude","rating","review_count","is_open","categories"
"Lee's Chinese Restaurant","9226 Ashton Rd","Philadelphia","PA","19114","40.0646797","-75.0210396","3.5","5","1","Restaurants, Chinese"
"Five Sisters Ice Cream and Sweets","1949 N Front St","Philadelphia","PA","19122","39.9798433","-75.1331384","4","21","1","Middle Eastern, Food, Ice Cream & Frozen Yogurt, Desserts, Restaurants"
"Triple Bottom Brewing","915 Spring Garden St","Philadelphia","PA","19123","39.962137","-75.153399","4","42","1","Food, Breweries"
"Diablo's Pizzas","34 W Girard Ave","Philadelphia","PA","19123","39.9686538","-75.1359472","4","5","1","Restaurants, Pizza, Tacos, Mexican, Chicken Wings"
"Walnut Street Cafe","2929 Walnut St","Philadelphia","PA","19104","39.9522079227","-75.183563153","3.5","253","1","Wine Bars, American (Traditional), Nightlife, Restaurants, Bars, Cafes, American (New)"
"Blaze Pizza","3400 Lancaster Ave","Philadelphia","PA","19104","39.9573344402","-75.1915253645","4","126","1","Pizza, Gluten-Free, Fast Food, Restaurants, Salad"
"Hot Pot Cuisine","4234 Germantown Ave","Philadelphia","PA","19140","40.0188931","-75.1560202","3.5","12","1","Caribbean, Restaurants"
"La Guerrerense","1143 S 9th St","Philadelphia","PA","19147","39.9350819","-75.1585329","5","6","1","Ice Cream & Frozen Yogurt, Food"
"Mighty Bread Company","1211 Gerritt St","Philadelphia","PA","19147","39.9322098","-75.164839","4.5","17","1","Specialty Schools, Cooking Schools, Desserts, Education, Food, Bakeries"
"Barrel's Fine Food","1725 Wolf St","Philadelphia","PA","19145","39.9228596","-75.1759474","4","49","1","Italian, Restaurants"
"Sweet As Fudge Candy Shoppe","12th & Arch St","Philadelphia","PA","19107","39.9539394","-75.1594308","4.5","52","1","Specialty Food, Candy Stores, Food, Chocolatiers & Shops, Desserts"
"T&N HomeMade Kitchen","1820 W Moyamensing Ave","Philadelphia","PA","19145","39.9143957","-75.1781475","4","83","1","Sandwiches, Caterers, Restaurants, Breakfast & Brunch, Fast Food, Delis, Event Planning & Services, Italian"
"Somerset Splits","2600 E Somerset St","Philadelphia","PA","19134","39.9805573775","-75.1131156832","4.5","46","1","Ice Cream & Frozen Yogurt, Food"
"QU JAPAN BISTRO & BAR","1635 Market St, Ste 103","Philadelphia","PA","19103","39.953712","-75.168052","4.5","118","1","Ramen, Japanese, Nightlife, Restaurants, Beer, Wine & Spirits, Food, Cocktail Bars, Sushi Bars, Bars"
"Ryan's Pub","4301 Main St","Philadelphia","PA","19127","40.0249636228","-75.2218963578","4","49","1","Bars, Irish Pub, Pubs, Nightlife, Restaurants"
"Monk Seafood","5018 N 5th St","Philadelphia","PA","19120","40.0278198","-75.1327267","3.5","9","1","Seafood Markets, Restaurants, Food, Seafood, Specialty Food, American (Traditional)"
"Center City Pretzel Co","816 Washington Ave","Philadelphia","PA","19147","39.9359328","-75.1575251","4.5","140","1","Bakeries, Food, Pretzels"
"Eagle Bar","3653 Germantown Ave","Philadelphia","PA","19140","40.0089586","-75.1504451","4.5","6","1","Nightlife, Bars, Restaurants"
"Mercer Cafe","2619 E Westmoreland St","Philadelphia","PA","19134","39.9864461","-75.1006826","4","90","1","Restaurants, Breakfast & Brunch, Pizza, Sandwiches, American (New), Cafes"
"Smile Cafe","105 S 22nd St","Philadelphia","PA","19103","39.9521517","-75.1768973","4","303","1","Noodles, Thai, Restaurants, Salad"
"World Cafe Live","3025 Walnut St","Philadelphia","PA","19104","39.9520744759","-75.1851766256","4","350","1","Nightlife, Arts & Entertainment, Restaurants, Music Venues, American (New), Bars, Jazz & Blues"
"Supreme Oasis Bakery & Deli-Philly","4401 Lancaster Ave","Philadelphia","PA","19104","39.9692521","-75.2116916","4","11","1","Fast Food, Restaurants, Soul Food, American (New)"
"Sue's Produce Market","114 S 18th St","Philadelphia","PA","19103","39.9512371","-75.1707037","4.5","119","1","Food, Specialty Food, Grocery, Fruits & Veggies"
"Gearo's","1913 Welsh Rd","Philadelphia","PA","19115","40.0820736","-75.0372482","3.5","89","1","Italian, Restaurants, Sandwiches, Pizza"
"Nan Zhou Hand Drawn Noodle House","1022 Race St","Philadelphia","PA","19107","39.9554005671","-75.1569010986","4","2188","1","Specialty Food, Noodles, Ethnic Food, Chinese, Comfort Food, Restaurants, Food"
"Tagliare","8500 Essington Ave","Philadelphia","PA","19153","39.8749289791","-75.2441923187","3.5","6","1","Restaurants, Breakfast & Brunch"
"Falone's Steaks & Hoagies","7337 Elmwood Ave","Philadelphia","PA","19142","39.91357","-75.24283","4","46","1","Restaurants, Sandwiches, Cheesesteaks"
"Nafi Food Express","3400 Market St","Philadelphia","PA","19104","39.95558","-75.193029","4.5","8","1","Indian, Food, Food Trucks, Halal, Restaurants"
"Ciao Pizza","1709 Chestnut St","Philadelphia","PA","19103","39.951761","-75.16913","3.5","64","1","Pizza, Restaurants"
"Red's Hoagies & Groceries","1900 S 9th St","Philadelphia","PA","19148","39.9256685","-75.1609566","3.5","12","1","Breakfast & Brunch, Bagels, Food, Delis, Restaurants"
"Great Awakenings Cafe","1466 E Cheltenham Ave","Philadelphia","PA","19124","40.02944","-75.081142","4.5","26","1","Desserts, Bakeries, Bagels, Coffee & Tea, Restaurants, Cafes, Food, Ice Cream & Frozen Yogurt"
"Ruth's Chris Steak House","1800 Market St","Philadelphia","PA","19103","39.9529565","-75.1702986","3.5","184","1","Wine Bars, Seafood, Restaurants, Steakhouses, Bars, American (Traditional), Nightlife"
"Giuseppe's Market at Samuels and Son Seafood","3400 S Lawrence St","Philadelphia","PA","19148","39.9049727","-75.1588247","4","17","1","Restaurants, Seafood Markets, Food, Specialty Food, Seafood"
"Bob & Barbara's","1509 South St","Philadelphia","PA","19146","39.94405","-75.16755","4","295","1","Lounges, Bars, Nightlife, Dive Bars, Adult Entertainment"
"Kale Yeah","301 Spring Garden St","Philadelphia","PA","19123","39.9612137","-75.1436613","5","53","1","Cafes, Sandwiches, Breakfast & Brunch, Restaurants, Salad"
"Ma Lessie's Chicken and Waffles","51 N 12th St","Philadelphia","PA","19107","39.9531593","-75.1590984","4","11","1","Chicken Shop, Restaurants, Waffles, Food, Soul Food, Food Trucks"
"El Jarocho","1138 S 13th St","Philadelphia","PA","19147","39.936492","-75.165011","4","445","1","Restaurants, Mexican"
"Evil Genius Beer","1727 N Front St","Philadelphia","PA","19122","39.9757885","-75.133938","4","283","1","Restaurants, Nightlife, Beer Gardens, Gastropubs, Food, Breweries"
"Johnny Chang's","2601 S Broad St","Philadelphia","PA","19148","39.9179792","-75.1707493","3.5","64","1","Restaurants, Thai, Japanese, Chinese"
"PrimoHoagies","2043 Chestnut St","Philadelphia","PA","19103","39.9523626789","-75.1750177145","4","154","1","Sandwiches, Restaurants, Italian"
"Big Charlie's Saloon","11TH St McKean St","Philadelphia","PA","19148","39.9249816447","-75.1640190527","4","17","1","Dive Bars, Nightlife, Bars"
"Fruit Salad & Smoothie Cart","13th & Chestnut St","Philadelphia","PA","19107","39.9505512096","-75.1618480682","4","6","1","Food, Food Stands, Restaurants"
"Molly Malloy's","1136 Arch St","Philadelphia","PA","19107","39.9531200778","-75.1589835418","4","339","1","American (New), Breakfast & Brunch, Gastropubs, Restaurants"
"Cosmi's Deli","1501 S 8th St","Philadelphia","PA","19147","39.9302586","-75.1579964","4","391","1","Delis, Restaurants, Food, Bakeries, Sandwiches, Cheesesteaks"
"Gino's Bakery","7142 Frankford Ave","Philadelphia","PA","19135","40.0355169","-75.0437628","5","11","1","Food, Restaurants, Bakeries"
"Bee Natural","51 N 12th St","Philadelphia","PA","19107","39.953647","-75.158911","4.5","26","1","Food, Home & Garden, Shopping, Candle Stores, Honey, Flowers & Gifts, Specialty Food, Beauty & Spas, Skin Care, Health Markets, Gift Shops"
"Double Knot","120 S 13th St","Philadelphia","PA","19107","39.9496993","-75.162185","4.5","1140","1","Nightlife, Sushi Bars, Cafes, Japanese, Bars, Restaurants"
"Georgian Bakery & Cafe","11749 Bustleton Ave","Philadelphia","PA","19116","40.1202789666","-75.0159822922","4.5","24","1","Restaurants, Cafes, Bakeries, Mediterranean, Food"
"Steve's Prince of Steaks","7200 Bustleton Ave","Philadelphia","PA","19149","40.0456111","-75.0609207","4","488","1","Restaurants, Sandwiches, Cheesesteaks, Steakhouses, American (Traditional)"
"Little Caesars","1701 Welsh Rd, Ste 3","Philadelphia","PA","19115","40.0875627874","-75.0392593629","3.5","8","1","Pizza, Food, Fast Food, Restaurants"
"Delancey Street Pizzeria","5701 Delancey St","Philadelphia","PA","19143","39.9554326","-75.2362495","3.5","8","1","Restaurants, Pizza"
"The Kettle Black","631 N 2nd St","Philadelphia","PA","19123","39.9615500201","-75.141204568","4.5","98","1","Bagels, Food, Bakeries, Coffee & Tea"
"Jet Wine Bar","1525 South St","Philadelphia","PA","19146","39.94403","-75.16799","4","166","1","American (New), Bars, Sandwiches, Wine Bars, Restaurants, Nightlife"
"Foghorn","4213 Ridge Ave","Philadelphia","PA","19129","40.0091071614","-75.1941820979","4","150","1","Restaurants, Chicken Shop, Southern"
"Tiger Sugar","6201 N Front St","Philadelphia","PA","19120","40.0457879427","-75.1191237563","4.5","5","1","Bubble Tea, Coffee & Tea, Desserts, Food"
"Fatboy and Slim's","3929 Sansom St","Philadelphia","PA","19104","39.9548253","-75.2009783","3.5","7","1","Bars, Nightlife, Pubs, Sports Bars, Restaurants, American (Traditional)"
"Jimmy's Water Ice","2251 S Front St","Philadelphia","PA","19148","39.9192063","-75.148602127","4.5","13","1","Food, Ice Cream & Frozen Yogurt, Pretzels, Shaved Ice, Cheesesteaks, Restaurants"
"Hinge Cafe","2652 E Somerset St","Philadelphia","PA","19134","39.9792581","-75.1121554","4.5","292","1","Nightlife, Arts & Entertainment, Caterers, Diners, Event Planning & Services, Restaurants, Coffee & Tea, Desserts, Food, Music Venues, Breakfast & Brunch, American (New), Cafes, Comfort Food"
"Chez Ben","401 Chestnut St","Philadelphia","PA","19106","39.9490604639","-75.147732608","3.5","24","1","Breakfast & Brunch, Bars, Wine Bars, Brasseries, French, Restaurants, Nightlife, Coffee & Tea, Food"
"Chestnut Hill Coffee Company","8620 Germantown Ave","Philadelphia","PA","19118","40.0769931299","-75.2083828102","4.5","198","1","Food, Coffee & Tea"
"Wild Crab Cajun Seafood & Bar","2051 Cottman Ave","Philadelphia","PA","19149","40.0505154","-75.0641719","4.5","9","1","Restaurants, Seafood, Bars, Nightlife, Beer Bar, Karaoke, Cocktail Bars"
"penrose cheesesteak","2201 Penrose Ave","Philadelphia","PA","19145","39.9102487","-75.1869588","3.5","12","1","Sandwiches, Ice Cream & Frozen Yogurt, Restaurants, Food, Bubble Tea, Cheesesteaks, Burgers, Seafood"
"The Crazy Leprechaun Bar & Grill","3589 Richmond St","Philadelphia","PA","19134","39.9876447657","-75.092066549","3.5","22","1","Nightlife, American (Traditional), Restaurants, Sports Bars, Bars, Irish Pub"
"New Garden","8033 Bustleton Ave","Philadelphia","PA","19152","40.0604703365","-75.0519053265","3.5","8","1","Restaurants, Chinese"
"Bridget Foy's","200 South St","Philadelphia","PA","19147","39.9411099","-75.1458162","4","18","1","American (Traditional), Salad, Soup, Restaurants"
"Rico Mexican Tacos","2084 E Allegheny Ave","Philadelphia","PA","19134","39.9920377","-75.109829","5","9","1","Mexican, Restaurants"
"Ishkabibble's","517 S St","Philadelphia","PA","19147","39.9419643","-75.1513895","3.5","191","1","Restaurants, Burgers, Cheesesteaks, American (Traditional)"
"PrimoHoagies","2703 E Clearfield St","Philadelphia","PA","19134","39.9828810847","-75.1046955585","4.5","18","1","Restaurants, Sandwiches, Italian, Food"
"Philly Pretzel Factory","2955 Market St","Philadelphia","PA","19104","39.9557798717","-75.1819683239","3.5","5","1","Pretzels, Food, Restaurants, Hot Dogs, Bakeries"
"Joe Santucci's Square Pizza Bar & Grill","4050 Woodhaven Rd","Philadelphia","PA","19154","40.0859595","-74.9711521","3.5","136","1","Food, Bars, Grocery, Pizza, Italian, Restaurants, Sandwiches, Nightlife, Salad, Seafood"
"Franklin Social","401 Chestnut St","Philadelphia","PA","19106","39.9490604639","-75.147732608","3.5","6","1","Breakfast & Brunch, Restaurants, Cafes"
"Guy Fieri’s Taco Joint","900 Packer Ave, Live! Casino Hotel","Philadelphia","PA","19148","39.9091912","-75.1646617","3.5","5","1","Tacos, Mexican, Restaurants"
"Tang's","37TH St And Spruce St","Philadelphia","PA","19104","39.9510287","-75.1972745","3.5","19","1","Chinese, Restaurants, Food Stands"
"Philly's Gourmet Steaks","114 Market St","Philadelphia","PA","19106","39.9496413446","-75.142798014","4","72","1","Cheesesteaks, Buffets, Sandwiches, Burgers, Restaurants, Breakfast & Brunch, Beer, Wine & Spirits, Food"
"Le Champignon De Tokio Sushi Bar","124-126 Lombard St","Philadelphia","PA","19147","39.9419732","-75.1448595","3.5","21","1","Restaurants, Japanese, Asian Fusion, Sushi Bars"
"Batter & Crumbs Vegan Bakery and Cafe","1401 Reed St","Philadelphia","PA","19146","39.933173","-75.168853","4.5","77","1","Bakeries, Custom Cakes, Food, Coffee & Tea, Restaurants, Cafes, Vegan"
"P&S Ravioli Company","1722 W Oregon Ave","Philadelphia","PA","19145","39.9173293","-75.1771444","4","28","1","Restaurants, Food, Sandwiches, Specialty Food, Italian"
"Dan Dan","126 S 16th St","Philadelphia","PA","19102","39.950247","-75.167598","4","860","1","Taiwanese, Restaurants, Noodles, Szechuan, Chinese"
"Little Delicious","4821 Woodland Ave","Philadelphia","PA","19143","39.9415445","-75.2123184","4","69","1","Restaurants, Caribbean"
"Vietnam Express","101 N 11th St","Philadelphia","PA","19107","39.954055","-75.1575729","4","69","1","Vietnamese, Sandwiches, Juice Bars & Smoothies, Restaurants, Bubble Tea, Food"
"Baan Thai","1030 N American St","Philadelphia","PA","19123","39.9671988","-75.140984","4","235","1","Restaurants, Thai, Desserts, Salad, Food"
"Al-Sham Restaurant","6738 Bustleton Ave","Philadelphia","PA","19149","40.0402499","-75.0661113","4","206","1","Food, Kosher, Restaurants, American (Traditional), Food Delivery Services, American (New), Halal, Middle Eastern"
"Ocho Rios Parrilla","1710 E Passyunk Ave","Philadelphia","PA","19148","39.928481","-75.1653571","4","6","1","Cocktail Bars, Vegetarian, Caribbean, Seafood, Nightlife, Bars, Restaurants"
"Panda Garden","275 W Mt Pleasant Ave","Philadelphia","PA","19119","40.0546452","-75.1939214","3.5","46","1","Restaurants, Chinese"
"Termini Bros Bakery","1701 John F Kennedy Blvd","Philadelphia","PA","19103","39.954737","-75.168614","4.5","46","1","Food, Bakeries"
"Canto House","941 Race St","Philadelphia","PA","19107","39.955579","-75.1556782","4","43","1","Restaurants, Chinese, Cantonese, Barbeque, Noodles"
"Angie's Kitchen","618 S 52nd St","Philadelphia","PA","19143","39.94995","-75.2272969","3.5","7","1","Restaurants, African"
"Freebyrd Chicken","111 S Independence Mall E","Philadelphia","PA","19106","39.9497563","-75.1480623","4","57","1","Caterers, Event Planning & Services, Restaurants, Sandwiches, Chicken Shop"
"China Gourmet","2842 St Vincent Street","Philadelphia","PA","19149","40.041592","-75.055007","4","132","1","Restaurants, Chinese, Cantonese, Dim Sum"
"Greenstreet Coffee Roastery","1919 Alter St","Philadelphia","PA","19146","39.9386566","-75.1758508","4.5","11","1","Coffee & Tea, Food, Coffee Roasteries"
"Bao Nine","38 S 19th St","Philadelphia","PA","19103","39.9523066495","-75.1719804481","4.5","138","1","Taiwanese, Restaurants, Asian Fusion"
"Tony's Place","6300 Frankford Ave","Philadelphia","PA","19135","40.0284115716","-75.0590577797","3.5","5","1","Restaurants, Pizza"
"Cedar Point Bar and Kitchen","2370 E Norris St","Philadelphia","PA","19125","39.9768423","-75.1277643","4","313","1","Southern, Bars, Cocktail Bars, Restaurants, Nightlife, Barbeque, Sandwiches, Beer, Wine & Spirits, American (Traditional), Food, American (New), Gastropubs"
"Bower Cafe","263 S 10th St","Philadelphia","PA","19107","39.946556","-75.157584","4.5","56","1","Restaurants, Cafes, Food, Coffee & Tea"
"West Tavern","1440 Callowhill St","Philadelphia","PA","19130","39.9595144642","-75.1634573936","3.5","88","1","Dive Bars, Nightlife, Restaurants, Bars, Karaoke"
"Apricot Stone","1040 N American St, Ste 601","Philadelphia","PA","19123","39.9673315908","-75.1404441921","4.5","310","1","Food, Restaurants, Armenian, Middle Eastern, Mediterranean"
"Billy Murphy's Irish Saloon","3333 Conrad St","Philadelphia","PA","19129","40.010788133","-75.1877212755","4.5","159","1","Irish Pub, Restaurants, Burgers, Nightlife, Dive Bars, American (New), Irish, Bars"
"Tommy DiNic's","1136 Arch St","Philadelphia","PA","19147","39.95347837","-75.1593960603","4","2221","1","Restaurants, American (Traditional), Sandwiches"
"El Taco","3233 Powelton Ave","Philadelphia","PA","19104","39.960636","-75.1891359","4","69","1","Restaurants, Mexican"
"ShopRite of Bridge & Harbison","5597 Tulip St","Philadelphia","PA","19124","40.0127313147","-75.0660249442","3.5","7","1","Grocery, Delis, Restaurants, Bakeries, Food"
"Torresdale Pizza","7517 Torresdale Ave","Philadelphia","PA","19136","40.032389","-75.0301971","4","6","1","American (Traditional), Pizza, Restaurants, Burgers"
"Philly Pretzel Factory","1532 Sansom St","Philadelphia","PA","19102","39.950452","-75.1670215","4","117","1","Food, Pretzels, Hot Dogs, Bakeries, Restaurants, Local Flavor"
"Palm Tree Market","717 N 2nd St","Philadelphia","PA","19123","39.9623128","-75.140731","4.5","87","1","Food, Convenience Stores, Grocery, Delicatessen, Restaurants, Coffee & Tea, Sandwiches"
"Indian Kitchen Lovash","236 South St","Philadelphia","PA","19147","39.94126","-75.1470703","3.5","278","1","Beer, Wine & Spirits, Gluten-Free, Salad, Vegan, Nightlife, Desserts, Event Planning & Services, Halal, Caterers, Pakistani, Bars, Food, Restaurants, Indian, Vegetarian, Cocktail Bars"
"Philadelphia Brewing Company","2440 Frankford Ave","Philadelphia","PA","19125","39.9826101","-75.1273561","4.5","150","1","Breweries, Food, Local Flavor"
"The Healing Arts Center of Philadelphia","123 Chestnut St, Ste 204","Philadelphia","PA","19106","39.948553","-75.143952","4.5","19","1","Tai Chi, Fitness & Instruction, Acupuncture, Traditional Chinese Medicine, Massage Therapy, Health & Medical, Chiropractors, Active Life"
"Wax + Wine","1034 Pine St","Philadelphia","PA","19107","39.9442985881","-75.1595780792","5","117","1","Home Decor, Wine Bars, Flowers & Gifts, Gift Shops, Art Classes, Beer, Wine & Spirits, Team Building Activities, Bars, Nightlife, Food, Paint & Sip, Candle Stores, Education, Home & Garden, Arts & Entertainment, Shopping, Event Planning & Services, Venues & Event Spaces"
"OCF Coffee House","2001 Federal St","Philadelphia","PA","19146","39.9374279","-75.1767938","3.5","59","1","Food, Coffee & Tea, Bagels, Internet Cafes"
"Nickels Tavern","2655 S 2nd St","Philadelphia","PA","19148","39.9144249","-75.151323","4","9","1","American (Traditional), Restaurants, Dive Bars, Nightlife, Bars"
"Painting with a Twist","611 South St","Philadelphia","PA","19147","39.942221","-75.1527801","4.5","45","1","Paint & Sip, Art Classes, Venues & Event Spaces, Event Planning & Services, Local Flavor, Education, Nightlife, Wine Bars, Arts & Entertainment, Bars, Party & Event Planning, Social Clubs"
"Xinying Chinese Restaurant","2403 E Somerset St","Philadelphia","PA","19134","39.983144","-75.114942","4","51","1","Restaurants, Chinese"
"Federal Donuts","540 South St","Philadelphia","PA","19147","39.9418004","-75.1522351","4","104","1","Donuts, Food, Restaurants, Coffee & Tea, Chicken Shop"
"Cold Cut Hut","2147 S 16th St","Philadelphia","PA","19145","39.9236465","-75.1730178","3.5","6","1","Delis, Food, Grocery, Convenience Stores, Restaurants"
"$5 Fresh Burger Stop","2100 W Oregon Ave","Philadelphia","PA","19145","39.9185202597","-75.1827766004","5","5","1","Restaurants, Food Stands, Burmese"
"Fitz and Starts","743 S 4th St","Philadelphia","PA","19147","39.939060062","-75.1495900378","4.5","30","1","Food, Restaurants, Bakeries, Wine Bars, Bars, American (New), Breakfast & Brunch, Nightlife"
"Southern Inn","5741 Woodland Ave","Philadelphia","PA","19143","39.9326866","-75.2245579","4","12","1","Hotels, Event Planning & Services, Restaurants, Hotels & Travel, Breakfast & Brunch"
"El Punto","4460 Whitaker Ave","Philadelphia","PA","19120","40.0171903","-75.1168879","4","33","1","Restaurants, Sandwiches"
"Wild Flour Bakery","8701 Torresdale Ave, Ste I","Philadelphia","PA","19136","40.043007493","-75.0064884844","4.5","14","1","Wholesalers, Professional Services, Bakeries, Food"
"Gnocchi","613 E Passyunk Ave","Philadelphia","PA","19147","39.9413851","-75.1503311","4","260","1","Italian, Restaurants"
"Stokes Sports Bar","2651 S 16th St","Philadelphia","PA","19145","39.9174069","-75.1743826","4","5","1","Sports Bars, Nightlife, Bars"
"Ramona Susan's Bake Shop","1255 Marlborough St","Philadelphia","PA","19125","39.971175099999996","-75.1323409","5","79","1","Food, Custom Cakes, Desserts, Bakeries, Cupcakes"
"Philly Poké","1016 Race St","Philadelphia","PA","19107","39.9552705","-75.1566319","4.5","76","1","Food, Restaurants, Sushi Bars, Fast Food, Poke"
"Taqueria La Prima","1104 S 9th St","Philadelphia","PA","19147","39.9360406751","-75.1585772758","4.5","12","1","Tacos, Restaurants, Mexican"
"Greensgrow West","5123 Baltimore Ave","Philadelphia","PA","19143","39.9480069","-75.226321","4.5","5","1","Home Services, Specialty Food, Farmers Market, Nurseries & Gardening, Shopping, Gardeners, Floral Designers, CSA, Event Planning & Services, Local Services, Community Service/Non-Profit, Christmas Trees, Home & Garden, Food"
"Sacred Paradise Spa","7203 Germantown Ave","Philadelphia","PA","19119","40.0604616","-75.1909623","4","19","1","Pilates, Nail Salons, Weight Loss Centers, Nail Technicians, Body Contouring, Fitness & Instruction, Skin Care, Beauty & Spas, Acupuncture, Reflexology, Health & Medical, Massage, Active Life, Day Spas, Food, Juice Bars & Smoothies, Medical Spas, Massage Therapy"
"Chipotle Mexican Grill","1512 Walnut St","Philadelphia","PA","19103","39.9495628765","-75.1666627067","3.5","115","1","Fast Food, Mexican, Restaurants, Food"
"Dunkin'","3601 Market St","Philadelphia","PA","19104","39.9566244","-75.194436","4.5","6","1","Food, Donuts, Coffee & Tea"
"Soul Boat","1422 Dickinson St","Philadelphia","PA","19146","39.9316669734","-75.1691339538","3.5","35","1","Restaurants, Seafood, Soul Food"
"Whipped Bakeshop","636 Belgrade St","Philadelphia","PA","19125","39.9745564","-75.1275515","4.5","235","1","Desserts, Food, Custom Cakes, Bakeries"
"Philadelphia Hotel Bella Vista","752 S 10th St","Philadelphia","PA","19147","39.9403402","-75.1594404","3.5","29","1","Hotels & Travel, Event Planning & Services, Bed & Breakfast, Hotels"
"Yakitori Boy","211 N 11th St","Philadelphia","PA","19107","39.9559497","-75.1571603","3.5","748","1","Japanese, Sushi Bars, Karaoke, Nightlife, Restaurants"
"Buffalo Billiards","118 Chestnut St","Philadelphia","PA","19106","39.94819","-75.1433","3.5","241","1","Sports Bars, Pool Halls, Nightlife, Restaurants, Bars, American (Traditional)"
"Wood Street Pizza","325 N 12th St","Philadelphia","PA","19107","39.9584362305","-75.1583431994","4","139","1","Pizza, Salad, Burgers, Sandwiches, Restaurants"
"Chiquita's Pizzeria & Mexican Grill","746 Snyder Ave","Philadelphia","PA","19148","39.9229037","-75.1596341","5","48","1","Mexican, Pizza, Restaurants, Italian"
"Café Soho","468 W Cheltenham Ave","Philadelphia","PA","19126","40.0550205","-75.1260334","4","800","1","Coffee & Tea, Food, Japanese, Restaurants, Chicken Wings, Korean, Asian Fusion"
"Tailhook","3522 Cottman Ave","Philadelphia","PA","19149","40.0371742","-75.0420841","4.5","10","1","Sports Bars, Bars, Dive Bars, Nightlife"
"Manayunk Pizza","4222 Manayunk Ave","Philadelphia","PA","19128","40.0268363","-75.21633","4","56","1","Sandwiches, Restaurants, Pizza, Burgers"
"Milan's Restaurant","140 W Wyoming Ave","Philadelphia","PA","19140","40.0216770872","-75.126149148","4","10","1","American (Traditional), Breakfast & Brunch, Restaurants"
"Ramen Bar","3438-48 Lancaster Ave","Philadelphia","PA","19104","39.957586","-75.1917594","3.5","88","1","Ramen, Bars, Japanese, Nightlife, Restaurants"
"Factory Donuts","7114 Frankford Ave","Philadelphia","PA","19135","40.035071","-75.0446184","4.5","139","1","Coffee & Tea, Food, Donuts, Bakeries"
"La Virgen De Las Nieves","1839 S 8th St","Philadelphia","PA","19148","39.9255887619","-75.1592664421","4","41","1","Restaurants, Mexican"
"Liberty Bell Diner","8445 Frankford Ave","Philadelphia","PA","19136","40.044553","-75.017575","3.5","153","1","Restaurants, Food, Breakfast & Brunch, Desserts, Diners, American (Traditional)"
"Tasty Twisters Bakery","5002 Umbria St","Philadelphia","PA","19128","40.0356086771","-75.235882548","4.5","51","1","Pretzels, Bakeries, Food, Restaurants, Fast Food"
"Jyoti Indian Bistro","7220 Germantown Ave","Philadelphia","PA","19119","40.0604497","-75.1915154","3.5","95","1","Indian, Restaurants"
"Marinucci's Deli - Mayfair","2852 Saint Vincent St","Philadelphia","PA","19149","40.0415039","-75.0541217","4.5","130","1","Delis, Restaurants"
"Mission BBQ","11000 Roosevelt Blvd","Philadelphia","PA","19116","40.1005522045","-75.0092536759","4","242","1","American (New), Barbeque, Restaurants"
"Sweet Charlie's","1921 Walnut St","Philadelphia","PA","19103","39.9506847","-75.173394","3.5","103","1","Ice Cream & Frozen Yogurt, Food, Desserts"
"1201 Bar","1201 S 28th St","Philadelphia","PA","19146","39.9389811","-75.1898882","3.5","5","1","Dive Bars, American (Traditional), Nightlife, Restaurants, Bars"
"E Mei Restaurant","915 Arch St","Philadelphia","PA","19107","39.9536815","-75.1554273","4","407","1","Szechuan, Chinese, Restaurants, Noodles, Soup"
"Abner's Cheesesteaks","3813 Chestnut St","Philadelphia","PA","19104","39.9553957","-75.1986337","3.5","223","1","Cheesesteaks, Restaurants, Sandwiches, Pizza, American (Traditional)"
