"name","address","city","state","zip_code","latitude","longitude","rating","review_count","is_open","categories"
"Fat Salmon","719 Walnut St","Philadelphia","PA","19106",39.9481318,-75.153395,4.5,1089,1,"Restaurants, Sushi Bars, Japanese"
"2637brew","2637 W Girard Ave","Philadelphia","PA","19130",39.974356,-75.18016842,4,121,1,"Nightlife, Cocktail Bars, Restaurants, American (Traditional), Bars, Breakfast & Brunch"
"Italian Express","2641 W Girard Ave","Philadelphia","PA","19130",39.9744283,-75.1802791,3.5,47,1,"Pizza, Sandwiches, Italian, Restaurants"
"Grubaholics","16 West Girard Ave","Philadelphia","PA","19123",39.96846,-75.1350433,4,17,1,"Ethnic Food, Food, Specialty Food, Food Trucks"
"Oui","160 N 3rd St","Philadelphia","PA","19106",39.953816,-75.144975,4.5,44,1,"Bakeries, Coffee & Tea, Desserts, Food"
"Castle Roxx","105 Shurs Ln","Philadelphia","PA","19127",40.0227275437,-75.2175221834,3.5,27,1,"Nightlife, Sports Bars, Bars, Pubs, Dive Bars"
"Hoagie Factory","2121 72nd Ave","Philadelphia","PA","19138",40.0645054,-75.1529533,4,29,1,"Restaurants, Delis"
"sweetgreen","1601 Market St","Philadelphia","PA","19103",39.9530218,-75.1675084,4,35,1,"Vegetarian, Salad, Restaurants, Soup"
"South Bowl","19 E Oregon Ave","Philadelphia","PA","19148",39.9142928,-75.1471501,3.5,249,1,"American (Traditional), Bars, Nightlife, Restaurants, American (New), Sports Bars, Active Life, Bowling, Pizza"
"Rec & Royal","111 S 17th St","Philadelphia","PA","19103",39.9510007892,-75.16874,4,17,1,"Bars, Karaoke, Dance Clubs, Nightlife, Venues & Event Spaces, Event Planning & Services"
"Disguiser Party Game Lounge","3617 Lancaster Ave","Philadelphia","PA","19104",39.9590456,-75.1941853,4,11,1,"Food, Arts & Entertainment, Bubble Tea, Arcades, Social Clubs"
"McCrossen's Tavern","529 N 20th St","Philadelphia","PA","19130",39.9630919,-75.1709203,4,293,1,"Nightlife, Restaurants, Gastropubs, Bars, Pubs, American (Traditional)"
"Su Xing House","1508 Sansom St","Philadelphia","PA","19102",39.950215,-75.166346,4,417,1,"Kosher, Chinese, Restaurants, Vegetarian, Vegan"
"Chick-A-Boom","4626 Lancaster Ave","Philadelphia","PA","19131",39.9711355,-75.215612,4,15,1,"Chicken Shop, Restaurants"
"Tony Roni's Pizza Roxborough","499 Domino Ln, Ste 4350","Philadelphia","PA","19128",40.0454066,-75.2327285,3.5,91,1,"Pizza, Food, Italian, Restaurants, Event Planning & Services, Caterers, Cheesesteaks"
"Shake Shack","105 S 12th St, Unit 1-01","Philadelphia","PA","19107",39.9502973,-75.1601048,3.5,66,1,"American (Traditional), Restaurants, Fast Food, Burgers"
"Dew's Deli","1710 S 10th St","Philadelphia","PA","19148",39.9280752,-75.16197,5,16,1,"Restaurants, Delis"
"Mike & Matt's Italian Market","1206 Mifflin St","Philadelphia","PA","19148",39.9262649,-75.1659695,4.5,14,1,"Food, Grocery, Meat Shops, Specialty Food, Restaurants, Delis"
"El Coqui Panaderia","3528 I St","Philadelphia","PA","19134",40.0026550293,-75.1114578247,4,46,1,"Delis, Bakeries, Caterers, Event Planning & Services, Restaurants, Spanish, Food, Puerto Rican, Caribbean"
"Noir Restaurant & Bar","1909 E Passyunk Ave","Philadelphia","PA","19148",39.9263049,-75.167423,4,154,1,"Restaurants, American (Traditional), Salad, Pubs, Nightlife, Bars, Italian"
"Jansen","7402 Germantown Ave","Philadelphia","PA","19119",40.0627073,-75.1931822,4.5,139,1,"American (New), Restaurants"
"Fuji Mountain","2030 Chestnut St","Philadelphia","PA","19103",39.9520801,-75.1747619,4,475,1,"Restaurants, Karaoke, Bars, Nightlife, Japanese, Sushi Bars"
"Original 13 Ciderworks","1526 N American St","Philadelphia","PA","19122",39.9745975872,-75.1402150467,4.5,65,1,"American (Traditional), Food, Restaurants, Bars, Pubs, American (New), Gluten-Free, Nightlife, Cideries"
"ALDI","1911 N 76th St","Philadelphia","PA","19151",39.9787458844,-75.2702441812,3.5,11,1,"Grocery, Specialty Food, Discount Store, Food, Fruits & Veggies, Beer, Wine & Spirits, Organic Stores, Shopping, Meat Shops"
"Mango Mango Dessert","1013 Cherry St","Philadelphia","PA","19107",39.9546606,-75.156606,4,234,1,"Food, Desserts, Shaved Ice, Waffles, Restaurants"
"Ming River Side Walk House","148 N 10th St","Philadelphia","PA","19107",39.9550532,-75.1562368,3.5,26,1,"Specialty Food, Food, Ethnic Food, Imported Food, Restaurants, Chinese, Noodles"
"Di Bruno Bros.","834 Chestnut St","Philadelphia","PA","19107",39.9491548072,-75.1555580299,4,105,1,"Specialty Food, American (New), Food, Beer Bar, Cheese Shops, Bars, Nightlife, Restaurants, Coffee & Tea, Meat Shops"
"House of Thai Cuisine","3520 Cottman Ave","Philadelphia","PA","19149",40.0372006,-75.0421226,4.5,266,1,"Restaurants, Thai"
"Dolce Carini","1929 Chestnut St","Philadelphia","PA","19103",39.9521232,-75.1729836,4,132,1,"Food, Restaurants, Food Delivery Services, Italian, Pizza"
"Umai Umai","533 N 22nd St","Philadelphia","PA","19130",39.9646735,-75.1741002,4.5,488,1,"Japanese, Sushi Bars, Asian Fusion, Restaurants"
"Nutmeg Cake Design","220 Krams Ave","Philadelphia","PA","19127",40.0305853,-75.2256405,5,12,1,"Food, Desserts, Bakeries, Cupcakes"
"T cafe","108 Chestnut St","Philadelphia","PA","19106",39.9480853,-75.1429316,4.5,59,1,"Bakeries, Desserts, Bubble Tea, Coffee & Tea, Restaurants, Breakfast & Brunch, Food"
"Star Pizza","5801 Torresdale Ave","Philadelphia","PA","19135",40.0162161,-75.0615677,3.5,7,1,"Restaurants, Pizza"
"Main Garden Chinese Restaurant","5150 N 5th St","Philadelphia","PA","19120",40.0300222,-75.1321794,3.5,8,1,"Chinese, Restaurants"
"Cafe Hindh","1336 Rising Sun Ave","Philadelphia","PA","19140",40.0031941,-75.151614,4,6,1,"Indian, Restaurants"
"Tea Do","3816 Chestnut St, Ste 36","Philadelphia","PA","19104",39.954682252,-75.1999465923,4,35,1,"Coffee & Tea, Juice Bars & Smoothies, Food, Fast Food, Restaurants, Bubble Tea"
"Almaz Cafe","140 S 20th St","Philadelphia","PA","19103",39.9506628,-75.1739332,4,381,1,"Ethiopian, Imported Food, Restaurants, Coffee & Tea, American (Traditional), Ethnic Food, Specialty Food, Food"
"Station Bar & Grill","1550 McKean St","Philadelphia","PA","19145",39.9258604,-75.1725846,3.5,58,1,"Bars, Arts & Entertainment, Nightlife, Sports Bars, Restaurants, American (Traditional), Gastropubs, Music Venues"
"Blaze Pizza","1100 W Montgomery Ave","Philadelphia","PA","19122",39.979333,-75.1530332,4.5,89,1,"Pizza, Gluten-Free, Restaurants, Salad, Fast Food"
"Gachi Sushi and Noodle","8000 Essington Ave, Terminal E","Philadelphia","PA","19153",39.874253,-75.251319,3.5,48,1,"Restaurants, Japanese, Sushi Bars, Noodles"
"Writer's Block Rehab","1342 Cypress St","Philadelphia","PA","19107",39.9463542742,-75.1635259249,4,182,1,"Lounges, Bars, Restaurants, Nightlife, Cafes, Cocktail Bars"
"Joe's Steaks + Soda Shop","1 W Girard Ave","Philadelphia","PA","19125",39.969035,-75.134557,4,392,1,"Restaurants, Ice Cream & Frozen Yogurt, Cheesesteaks, Food, Sandwiches, American (Traditional)"
"Gardendale Social Club","417 N 8th St","Philadelphia","PA","19123",39.9590475,-75.1515738,4,11,1,"Bars, Lounges, Nightlife"
"Lil' Pop Shop","265 S 44th St","Philadelphia","PA","19104",39.9533432722,-75.2103484422,4.5,285,1,"Food, Ice Cream & Frozen Yogurt, Desserts"
"Viet Bistro","1640 S St","Philadelphia","PA","19146",39.9440531,-75.1701109,4.5,14,1,"Sandwiches, Vietnamese, Restaurants, Soup, Noodles"
"El Rancho Viejo","942 S 5th St","Philadelphia","PA","19147",39.936282,-75.152142,5,110,1,"Restaurants, Mexican"
"I Tea","1537 Spring Garden St","Philadelphia","PA","19130",39.96306,-75.164148,4,163,1,"Chinese, Ice Cream & Frozen Yogurt, Tea Rooms, Japanese, Food, Restaurants"
"Careda's Caribbean Cuisine","51 north 12th street","Philadelphia","PA","19107",39.953194,-75.159407,3.5,27,1,"Caribbean, Cooking Classes, Restaurants, Arts & Crafts, Event Planning & Services, Shopping, Personal Chefs, Caterers"
"China King","922 Arch St","Philadelphia","PA","19107",39.953346,-75.1555641,4.5,14,1,"Restaurants, Chinese"
"Love City Brewing Company","1023 Hamilton St","Philadelphia","PA","19123",39.9603099077,-75.1554151252,4.5,162,1,"Brewpubs, Breweries, Nightlife, Bars, Food, Bar Crawl"
"Graham's Pub","8919 Ridge Ave","Philadelphia","PA","19128",40.0694581,-75.2398389,3.5,17,1,"Bars, Pubs, Nightlife, Dive Bars"
"Mr Wish","6846 Bustleton Ave","Philadelphia","PA","19149",40.0417146,-75.064734,4,75,1,"Juice Bars & Smoothies, Cocktail Bars, Bars, Cafes, Bubble Tea, Restaurants, Nightlife, Food"
"El Azteca","6613 Frankford Ave","Philadelphia","PA","19135",40.030807,-75.053964,4,10,1,"Desserts, Food, Salad, Restaurants, Mexican"
"Mipals Deli","2300 S 16th St","Philadelphia","PA","19145",39.9222656,-75.1737245,4.5,50,1,"Restaurants, Sandwiches, Delis"
"King of Pizza","3633 Germantown Ave","Philadelphia","PA","19140",40.0084534,-75.1503539,4.5,28,1,"Restaurants, Pizza"
"Hummingbird Diner","1530 E Wadsworth Ave","Philadelphia","PA","19150",40.0795109,-75.173133,3.5,19,1,"Restaurants"
"Mask and Wig","310 S Quince St","Philadelphia","PA","19107",39.946013,-75.160521,4.5,15,1,"Social Clubs, Bars, Venues & Event Spaces, Performing Arts, Event Planning & Services, Nightlife, Arts & Entertainment, Comedy Clubs, Local Flavor"
"Urban Farmer Philadelphia","1850 Benjamin Franklin Pkwy","Philadelphia","PA","19103",39.957207,-75.1699827,4,597,1,"Steakhouses, Restaurants, American (Traditional)"
"Independence Visitor Center","599 Market St","Philadelphia","PA","19106",39.9509761191,-75.1500126909,4.5,141,1,"Breakfast & Brunch, Landmarks & Historical Buildings, Hotels & Travel, Local Flavor, Museums, Public Services & Government, Restaurants, Travel Services, Arts & Entertainment, Ticket Sales, Visitor Centers"
"Arch Gourmet","2200 Arch St","Philadelphia","PA","19103",39.9560712,-75.1769425,3.5,36,1,"Convenience Stores, Event Planning & Services, Caterers, Food, Restaurants, Delis, Grocery"
"Aya Asian Fusion","7313-15 Frankford Ave","Philadelphia","PA","19136",40.0368091,-75.0399005,3.5,127,1,"Sushi Bars, Japanese, Chinese, Thai, Food, Restaurants"
"Ting Wong Restaurant","138 N 10th St","Philadelphia","PA","19107",39.954754,-75.156191,4,461,1,"Noodles, Asian Fusion, Restaurants, Chinese, Seafood"
"High Point Cafe","7210 Cresheim Rd","Philadelphia","PA","19119",40.0575169,-75.1946237,4,46,1,"Coffee & Tea, Food, Bakeries"
"Nile Cafe","6008 Germantown Ave","Philadelphia","PA","19144",40.039489,-75.1780373,4.5,83,1,"Vegetarian, Soul Food, Vegan, Restaurants"
"Hutchinson's Classic Bakery","13023 Bustleton Ave","Philadelphia","PA","19116",40.1239074,-75.014565,4,20,1,"Food, Bakeries"
"The Stand","1844 W Hunting Park Ave","Philadelphia","PA","19140",40.0137755,-75.1579013,3.5,5,1,"Chicken Wings, Steakhouses, American (New), Restaurants"
"The QUICK FIXX","1511 South St","Philadelphia","PA","19146",39.944064,-75.1676029,4,324,1,"Restaurants, Pizza, Vegetarian, Salad, Italian"
"A La Mousse","1622 South St","Philadelphia","PA","19146",39.9439931,-75.1695751,5,59,1,"Coffee & Tea, Desserts, Food, Restaurants, Cafes"
"Original Pete's Pizza and Wings","7229 Passyunk Ave","Philadelphia","PA","19142",39.913708995,-75.2402606546,3.5,66,1,"Sandwiches, Restaurants, Pizza, Chicken Wings"
"Front Street Dive","10 S Front S, Fl 2","Philadelphia","PA","19106",39.9493463,-75.1423488,4,15,1,"Karaoke, Nightlife, Dance Clubs, Bars, Dive Bars"
"Ba Le Bakery","606 Washington Ave","Philadelphia","PA","19147",39.9349047,-75.1543101,3.5,234,1,"Food, Bakeries, Restaurants, Vietnamese, Sandwiches"
"Saudia Shuler's Country Cookin'","2836 N 22nd St","Philadelphia","PA","19132",39.9981226,-75.1672837,3.5,178,1,"Soul Food, Restaurants"
"Matcha Cafe Maiko","923 Race St","Philadelphia","PA","19107",39.9555635,-75.1551081,4,46,1,"Cafes, Food, Desserts, Coffee & Tea, Shaved Ice, Restaurants, Japanese, Ice Cream & Frozen Yogurt"
"Maxx's Produce","255 S 20th St","Philadelphia","PA","19103",39.9487482,-75.1739753,4.5,46,1,"Fruits & Veggies, Specialty Food, Food, Grocery"
"Michael's Place","1142 Mifflin St","Philadelphia","PA","19148",39.9261892,-75.1654027,3.5,9,1,"Nightlife, Bars, Dive Bars"
"Assembly","1840 Benjamin Franklin Pkwy","Philadelphia","PA","19103",39.9568477,-75.1697412,3.5,193,1,"Nightlife, Lounges, Bars"
"Mary Cassatt Tea Room","210 W Rittenhouse Sq","Philadelphia","PA","19103",39.949901,-75.173049,4,68,1,"Tea Rooms, Coffee & Tea, Food"
"M2O Burgers & Salads","701 S 5th St","Philadelphia","PA","19147",39.9403662,-75.1508793,4,111,1,"Juice Bars & Smoothies, Salad, Restaurants, Food, Burgers, American (Traditional)"
"Schenk's Family Bakery","7951 Verree Rd","Philadelphia","PA","19111",40.0722475,-75.0761885,4,44,1,"Food, Bakeries, Restaurants"
"A Lin Kitchen","1942 S 9th St","Philadelphia","PA","19148",39.924614,-75.161195,3.5,55,1,"Chinese, Restaurants, American (New), Asian Fusion, American (Traditional)"
"Uncle Oogie's","36 Snyder Ave","Philadelphia","PA","19148",39.9209324,-75.1465573,3.5,65,1,"Italian, Food, Restaurants, Pizza"
"DJ Kitchen","4040 City Ave","Philadelphia","PA","19131",40.0074349,-75.2124437,4.5,117,1,"Restaurants, Chinese, Noodles, Dim Sum, Bubble Tea, Food, Szechuan"
"Kelliann's Bar & Grill","1549 Spring Garden St","Philadelphia","PA","19130",39.9630941,-75.1645294,4,111,1,"American (Traditional), Nightlife, Restaurants, Bars"
"Kyoto Japan","37 Snyder Ave","Philadelphia","PA","19148",39.9217799,-75.1465813,3.5,39,1,"Sushi Bars, Restaurants, Japanese"
"Tranzilli Real Italian Water Ice","5901 Belfield Ave","Philadelphia","PA","19144",40.045108251,-75.1700755888,4.5,20,1,"Food, Ice Cream & Frozen Yogurt"
"Kung Fu Tea","1006 Arch St","Philadelphia","PA","19107",39.95349,-75.156748,3.5,314,1,"Restaurants, Taiwanese, Bubble Tea, Juice Bars & Smoothies, Food, Coffee & Tea"
"Punch Line Philly","33 E Laurel St","Philadelphia","PA","19123",39.965141,-75.135429,3.5,273,1,"American (New), Nightlife, Restaurants, Arts & Entertainment, Comedy Clubs, Performing Arts, Bars"
"Sushi Ya","1418 W Girard Ave","Philadelphia","PA","19130",39.971422823,-75.1604533705,5,8,1,"Sushi Bars, Japanese, Restaurants"
"Thomasena's  Restaurant","2374 Orthodox St","Philadelphia","PA","19137",40.0052393,-75.0781847,3.5,63,1,"Restaurants, Southern, Cafeteria, Soul Food"
"Maglio Sausage","3632 S 3rd St","Philadelphia","PA","19148",39.901575199999996,-75.1554563,5,14,1,"Caterers, Event Planning & Services, Meat Shops, Restaurants, Specialty Food, Cheese Shops, Food, Italian"
"Cherry Street Tavern","129 N 22nd St","Philadelphia","PA","19103",39.9570188,-75.1758021,4,152,1,"Beer Bar, Sandwiches, Nightlife, Bars, Restaurants, Pubs"
"San Miguelito Mexican Cuisine","2654 S Sixth St","Philadelphia","PA","19148",39.9153804,-75.1583858,4.5,62,1,"Mexican, Restaurants"
"MilkBoy","1100 Chestnut St","Philadelphia","PA","19107",39.950125,-75.1587931,3.5,383,1,"Coffee & Tea, Food, American (New), Arts & Entertainment, Nightlife, Music Venues, Restaurants, Bars"
"Tom's Dim Sum","59 N 11th St","Philadelphia","PA","19107",39.9532889,-75.1578543,3.5,587,1,"Restaurants, Chinese, Shanghainese, Dim Sum"
"Moju's Family Pizzeria","2501 E Westmoreland St","Philadelphia","PA","19134",39.9883251094,-75.1025135815,4,59,1,"Pizza, Restaurants"
"Pop Up Café","802 Christian St","Philadelphia","PA","19147",39.9385067392,-75.1565579,5,6,1,"Restaurants, Vietnamese"
"Nitty's Tavern","1720 W Moyamensing Ave","Philadelphia","PA","19145",39.914962,-75.1766207,3.5,8,1,"Restaurants, Italian, Sports Bars, Nightlife, Bars"
"Popeyes Louisiana Kitchen","122 W Chelten Ave","Philadelphia","PA","19144",40.0333871422,-75.1769684332,4.5,5,1,"Fast Food, Chicken Wings, Restaurants, Southern, American (Traditional)"
"ALDI","3101 W Girard Ave","Philadelphia","PA","19130",39.9760595143,-75.1868677139,4,25,1,"Grocery, Fruits & Veggies, Shopping, Specialty Food, Discount Store, Food, Beer, Wine & Spirits, Organic Stores, Meat Shops"
"Frida Cantina","1000 Wolf St","Philadelphia","PA","19148",39.9208815,-75.1635559,4.5,75,1,"Bars, Nightlife, Mexican, Restaurants"
"Moonshine Philly","1825 E Moyamensing Ave","Philadelphia","PA","19148",39.9249989,-75.151605,4,223,1,"Bars, Nightlife, Pubs, Gastropubs, Restaurants"
"Nori Ramen & Poke Bowl","9475 Roosevelt Blvd","Philadelphia","PA","19114",40.0796573592,-75.0272364667,4,15,1,"Seafood, Ramen, Restaurants, Hawaiian, Japanese"
"New Golden House","5833 Germantown Ave","Philadelphia","PA","19144",40.0377555,-75.1761754,3.5,7,1,"Chinese, American (New), Restaurants"
"La Sushi","712 W Girard Ave","Philadelphia","PA","19123",39.9701516,-75.1488375,4,26,1,"Latin American, Bars, Restaurants, Japanese, Nightlife, Sushi Bars"
"Far East Descendant","251 N Clarion St","Philadelphia","PA","19107",39.957109757,-75.1608705747,4.5,10,1,"Cantonese, Restaurants, Speakeasies, Bars, Nightlife, Chinese, Lounges"
"Mandarin House","3 W Girard Ave","Philadelphia","PA","19123",39.9689697589,-75.1346291263,3.5,56,1,"Chinese, Restaurants"
"Yanako","4345 Main St","Philadelphia","PA","19127",40.0256009,-75.2234981,4,276,1,"Restaurants, Japanese, Sushi Bars"
"Tiffany's Bakery","1001 Market St","Philadelphia","PA","19107",39.952841,-75.157056,3.5,110,1,"Coffee & Tea, Event Planning & Services, Bakeries, Caterers, Food, Restaurants, Desserts, Patisserie/Cake Shop, Cupcakes"
"El Sabor De Maria","4903 N 5th St","Philadelphia","PA","19120",40.029653,-75.132293,4,8,1,"Latin American, Restaurants, Colombian"
"Doliva Evoo Pizza & Grill ","1009 N Bodine St","Philadelphia","PA","19123",39.9672300847,-75.1409808273,4.5,83,1,"American (Traditional), Italian, Restaurants, Pizza"
"Rex at the Royal","1524 S St","Philadelphia","PA","19146",39.9437809,-75.1681729,4.5,471,1,"Southern, Restaurants, Seafood, Salad, American (New)"
"Alex's Pizzeria","400 Leverington Ave","Philadelphia","PA","19128",40.0340479,-75.2208998,3.5,57,1,"Restaurants, Pizza"
"Gyu-Kaku Japanese BBQ","1901 Callowhill St","Philadelphia","PA","19130",39.9607160127,-75.1701319521,3.5,569,1,"Tapas/Small Plates, Restaurants, Barbeque, Japanese, Asian Fusion"
"Kitchen Kapers","213 S 17th St","Philadelphia","PA","19103",39.9495062,-75.1691002,4,63,1,"Shopping, Specialty Food, Appliances, Kitchen & Bath, Food, Electronics, Home & Garden"
"The Dutch","1527 S 4th St","Philadelphia","PA","19147",39.9288513959,-75.1521847471,4,334,1,"Salad, Breakfast & Brunch, Sandwiches, Restaurants"
"Wawa","2600 Grant Ave","Philadelphia","PA","19114",40.077368,-75.023674,5,9,1,"Coffee & Tea, Gas Stations, Food, Automotive, Restaurants, Convenience Stores, Sandwiches"
"No 1 China","8743 Frankford Ave","Philadelphia","PA","19136",40.0481891,-75.0126365,4,19,1,"Restaurants, Chinese"
"Lorraine","1502 Brown St","Philadelphia","PA","19130",39.968118407,-75.1623112238,4,30,1,"Nightlife, Bars"
"Jade Harbor","6863 Bustleton Ave","Philadelphia","PA","19149",40.0413621,-75.0643869,3.5,98,1,"Dim Sum, Chinese, Cantonese, Restaurants"
"63rd St Pizza","6300 Wheeler St","Philadelphia","PA","19142",39.9246525,-75.2286375,3.5,9,1,"Restaurants, Pizza, Fast Food"
"El Provocon Restaurant II","141 W Wyoming Ave","Philadelphia","PA","19140",40.0220092,-75.1261474,4,7,1,"Restaurants"
"Tea Do","132 N 10th St","Philadelphia","PA","19107",39.954605,-75.156209,4,835,1,"Juice Bars & Smoothies, Bubble Tea, Food, Coffee & Tea"
"Standard Tap","901 N 2nd St","Philadelphia","PA","19123",39.96414,-75.1405144,4,785,1,"Local Flavor, American (Traditional), Restaurants, Burgers, Desserts, Breakfast & Brunch, Food, American (New), Gastropubs, Beer, Wine & Spirits, Nightlife, Bars, Pubs"
"The Ranchito","4745 Rising Sun Ave","Philadelphia","PA","19120",40.0228625,-75.1242773,3.5,8,1,"Latin American, Restaurants, Dominican, Caribbean, Mexican"
"Del Rossi's Cheesesteak","538 N 4th St","Philadelphia","PA","19123",39.9615077,-75.1450865,3.5,338,1,"Cheesesteaks, Burgers, Restaurants, Pizza, Caterers, Food Delivery Services, Food, Event Planning & Services"
"Six Fishes Neighborhood Acupuncture","2308 Grays Ferry Ave","Philadelphia","PA","19146",39.945047,-75.1803019,4.5,19,1,"Traditional Chinese Medicine, Acupuncture, Health & Medical, Massage Therapy"
"Passero's Coffee Roasters","834 Chestnut St","Philadelphia","PA","19107",39.9496785559,-75.1548227944,4.5,57,1,"Cafes, Coffee Roasteries, Food, Coffee & Tea, Restaurants"
"Uncle's Seafood","1915 W Hunting Park Ave","Philadelphia","PA","19140",40.0139965,-75.1585169,4,8,1,"Seafood, Restaurants"
"Poe's Sandwich Joint","1710 N 5th St","Philadelphia","PA","19122",39.9773029,-75.1436018,4,122,1,"Sandwiches, American (Traditional), Restaurants"
"Masala Kitchen: Kati Rolls & Platters","2004 Chestnut St","Philadelphia","PA","19103",39.951890375,-75.1738043,4.5,40,1,"Restaurants, Indian"
"Mood Indian Restaurant","423 W Girard Ave","Philadelphia","PA","19123",39.9703256,-75.1440831,3.5,111,1,"Restaurants, Indian"
"Golden China","6000 Oxford Ave","Philadelphia","PA","19111",40.0368847,-75.0884941,3.5,5,1,"Restaurants, Chinese"
"Hi Kori","1016 Race St","Philadelphia","PA","19107",39.9552705,-75.1566243,4.5,50,1,"Bars, Japanese, Restaurants, Nightlife"
"New York Gyro Halal Food Cart","SE Corner Of 11th St And Walnut St","Philadelphia","PA","19107",39.948694,-75.1589575,4.5,62,1,"Restaurants, Food Stands, Food"
"Elixr Coffee","3675 Market St","Philadelphia","PA","19104",39.9566794,-75.1951199,4.5,16,1,"Food, Coffee & Tea, Coffee Roasteries"
"Dutch Eating Place","1136 Arch St","Philadelphia","PA","19107",39.9534618209,-75.1593213069,4.5,796,1,"Sandwiches, Restaurants, Juice Bars & Smoothies, Food, Breakfast & Brunch"
"V Marks the Shop","1515 McKean St","Philadelphia","PA","19145",39.9260333,-75.171741,5,15,1,"Specialty Food, Food, Grocery, Convenience Stores"
"Judy's Kitchen","3300 Arch St","Philadelphia","PA","19104",39.957619986,-75.1893085241,3.5,5,1,"Restaurants, Soul Food"
"Charlies Country Ribs","2528 W Diamond St","Philadelphia","PA","19121",39.9870884,-75.1758676,3.5,23,1,"Sandwiches, Soul Food, Barbeque, Restaurants"
"Fame's Famous Pizza","1835 N 12th St, Ste 99","Philadelphia","PA","19122",39.9809158,-75.153284,3.5,17,1,"Restaurants, Pizza"
"Silk City Diner & Lounge","435 Spring Garden St","Philadelphia","PA","19123",39.9613271,-75.1460328,4,940,1,"Dance Clubs, Bars, Diners, Breakfast & Brunch, Lounges, Restaurants, Nightlife, American (New)"
"Island Taste Restaurant","5518 N 5th St","Philadelphia","PA","19120",40.0355548,-75.1310164,4,7,1,"Caribbean, Restaurants"
"Bao & Bun Studio","5401 Tacony St, Bldg 39","Philadelphia","PA","19137",40.0089527,-75.0640806,5,25,1,"Restaurants, Taiwanese, Pan Asian, Street Vendors, Food"
"Philly Fry Truck","","Philadelphia","PA","19147",39.9350642,-75.1516194,4,13,1,"Street Vendors, Event Planning & Services, Food, Restaurants, Caterers, Food Trucks, American (Traditional)"
"Pret A Manger","2955 Market St","Philadelphia","PA","19104",39.955651,-75.182149,4,34,1,"Bakeries, Restaurants, Coffee & Tea, Food, Sandwiches, Breakfast & Brunch"
"Wawa","518-520 South 2nd St","Philadelphia","PA","19147",39.941882,-75.1457641,4,39,1,"Food, Sandwiches, Restaurants, Convenience Stores, Coffee & Tea"
"CO-OP Restaurant & Lounge","20 S 33rd St","Philadelphia","PA","19104",39.9544058,-75.1900591,3.5,128,1,"Restaurants, American (New), Bars, Breakfast & Brunch, Coffee & Tea, Food, Cocktail Bars, Nightlife"
"Fight Firm","461 N 9th St","Philadelphia","PA","19123",39.9604,-75.1528521,4.5,7,1,"Martial Arts, Fitness & Instruction, Brazilian Jiu-jitsu, Kickboxing, Boxing, Muay Thai, Amateur Sports Teams, Gyms, Active Life"
"Sawatdee Thai Restaurant","534 S 15th St","Philadelphia","PA","19146",39.9439767,-75.1673407,3.5,206,1,"Thai, Restaurants"
"Frank's Steaks & Burgers","7161 Frankford Ave","Philadelphia","PA","19135",40.0357067,-75.0424596,3.5,58,1,"Delis, Sandwiches, Restaurants, Burgers, Cheesesteaks"
"Ray's Happy Birthday Bar","1200 E Passyunk Ave","Philadelphia","PA","19147",39.9340955,-75.1584681,3.5,141,1,"Nightlife, Bars, Dive Bars"
"Heritage","914 N 2nd St","Philadelphia","PA","19123",39.9645949,-75.1408296,4,297,1,"Restaurants, American (New), Arts & Entertainment, Jazz & Blues, Nightlife, Bars"
"The Continental Mid-town","1801 Chestnut St","Philadelphia","PA","19103",39.9519308,-75.1704529,3.5,1682,1,"Breakfast & Brunch, Lounges, Bars, Cocktail Bars, Nightlife, American (Traditional), American (New), Restaurants"
"La Famiglia Ristorante","8 S Front St","Philadelphia","PA","19106",39.9494022,-75.1424185,4,140,1,"Italian, Restaurants"
"Philly Pretzel Factory","3377 Aramingo Ave","Philadelphia","PA","19134",39.9895469,-75.1017481,3.5,8,1,"Bakeries, Pretzels, Hot Dogs, Food, Restaurants"
"The Hubble Bubble Hookah Lounge","1000 Diamond St","Philadelphia","PA","19122",39.9834801,-75.1499321,4,24,1,"Lounges, Local Flavor, Arts & Entertainment, Social Clubs, Hookah Bars, Nightlife, Bars"
"AJ Pickle Patch and Salads","12th St  & Arch St","Philadelphia","PA","19176",39.9539376,-75.159431,4.5,12,1,"Sandwiches, Delis, Restaurants"
"Saffron Patch - Authentic Indian Restaurant","1849 Wolf St","Philadelphia","PA","19145",39.9230489,-75.1780791,4,64,1,"Chicken Shop, Vegetarian, Restaurants, Indian, Seafood, Halal"
"Sharkey's Grill And Ale House","7401 State Rd","Philadelphia","PA","19136",40.0272541026,-75.0284319977,5,6,1,"American (Traditional), Restaurants, Seafood"
"Higher Grounds","631 N 3rd St","Philadelphia","PA","19123",39.9620702366,-75.1429857686,4,159,1,"Food, Coffee & Tea"
"Cafe Old Nelson","1435 Arch St","Philadelphia","PA","19102",39.9547834,-75.1646992,3.5,32,1,"Delis, Food, Restaurants"
"Knockbox Cafe","405 S 45th St","Philadelphia","PA","19104",39.9514434,-75.2123412,4,115,1,"Coffee & Tea, Bagels, Food, Restaurants, Sandwiches, Bakeries"
"Pelicana Chicken","6201 N Front St","Philadelphia","PA","19120",40.0452787399,-75.1172783944,3.5,11,1,"Chicken Shop, Korean, Chicken Wings, Restaurants"
"Hong Kong Bakery Shop","917 Race St","Philadelphia","PA","19107",39.9553886,-75.154976,3.5,53,1,"Food, Restaurants, Bakeries"
